Issue,Subject,Company,status,product_area,response,justification,request_type
,,,replied,card_management,"Based on the support documentation: Resuming Your Subscription If you attempt to log in during the paused period, you cannot access your HackerRank account. A popup notification will inform you of the status of the pause. To resume your subscription: Click Resume Early to visit the Billing page. On the billing page, click Resume Plan . Section 2 (Document: Hackerrank\Settings\Teams Management\6534774997 Locking User Access From Hackerrank Path: hackerrank\settings\teams management\6534774997 locking user access from hackerrank.md) You can unlock a user account to restore access to the platform at any time. To unlock user access: 1. Go to the Users tab. 2. Locate the user you want to unlock. 3. Click the more options menu under Actions . 4. Select Unlock User. 5. In the Unlock Users dialog: 1. Select the team to assign the...","Extractive fallback from local corpus (card_management). Note: OpenRouter error: Error code: 429 - {'error': {'message': 'Provider returned error', 'code': 429, 'metadata': {'raw': 'google/gemma-4-26b-a4b-it:free is temporarily rate-limited upstream. Please retry shortly, or add your own key to accumulate your rate limits: https://openrouter.ai/settings/integrations', 'provider_name': 'Google AI Studio', 'is_byok': False}}, 'user_id': 'user_3DBHm4ADjGfuzNJ3wqQ4bnIGJul'}.",product_issue
,,,replied,test_management,"Based on the support documentation: Refund policy If you accidentally make a purchase or are not satisfied with your mock interview, contact help@hackerrank.com. The support team will promptly review your request. Section 2 (Document: Hackerrank\Hackerrank Community\Subscriptions Payments And Billing\4312449655 Upgrade Subscription Plan Path: hackerrank\hackerrank community\subscriptions payments and billing\4312449655 upgrade subscription plan.md) Note: Credits are the entitlements included in your subscription. For example, three AI Mock Interviews per month, two Mock Tests per month with detailed performance reports. Upgrade options The following upgrade paths are available based on your current subscription and billing cycle: From Basic Basic → Plus Monthly Basic → Plus Quarterly Basic → Infinity Monthly Basic → Infin...","Extractive fallback from local corpus (test_management). Note: OpenRouter error: Error code: 429 - {'error': {'message': 'Provider returned error', 'code': 429, 'metadata': {'raw': 'google/gemma-4-26b-a4b-it:free is temporarily rate-limited upstream. Please retry shortly, or add your own key to accumulate your rate limits: https://openrouter.ai/settings/integrations', 'provider_name': 'Google AI Studio', 'is_byok': False}}, 'user_id': 'user_3DBHm4ADjGfuzNJ3wqQ4bnIGJul'}.",product_issue
,,,replied,assessment_integrity,Based on the support documentation: Candidate Tags Labels or tags assigned to the candidate. ATS Status Candidate’s status in the applicant tracking system. Candidate Status Current status of the candidate in the test workflow. Candidate Record Created At Date and time when the candidate record was created. Detailed Report URL Link to the candidate’s detailed report. Test Max Score Maximum possible score for the test. Is GDPR Deleted Indicates if candidate data has been deleted for GDPR compliance. IP Address IP address of the candidate. Recency Status (Invite / Attempt) Indicates latest invite/attempt. Fullscreen Exit Count Number of times the candidate exited fullscreen mode. Plagiarism Report URL URL of the plagiarism report. Fullscreen Exit Duration (s) Total time spent outside fullscreen. Suspicion Category Category...,"Extractive fallback from local corpus (assessment_integrity). Note: OpenRouter error: Error code: 429 - {'error': {'message': 'Provider returned error', 'code': 429, 'metadata': {'raw': 'google/gemma-4-26b-a4b-it:free is temporarily rate-limited upstream. Please retry shortly, or add your own key to accumulate your rate limits: https://openrouter.ai/settings/integrations', 'provider_name': 'Google AI Studio', 'is_byok': False}}, 'user_id': 'user_3DBHm4ADjGfuzNJ3wqQ4bnIGJul'}.",product_issue
,,,replied,integrations_security,"Based on the support documentation: Configuring SCIM Provisioning with Okta The process of configuring SCIM Provisioning with Okta includes the following: 1. Generating an API Key from HackerRank 2. Configuring Provisioning for HackerRank 3. Importing Users 4. Provisioning Steps Section 2 (Document: Hackerrank\Integrations\Single Sign On Sso\3939437783 Setting Up Scim Provisioning With Okta Path: hackerrank\integrations\single sign on sso\3939437783 setting up scim provisioning with okta.md) source url: ""https://support.hackerrank.com/articles/3939437783 setting up scim provisioning with okta"" article slug: ""3939437783 setting up scim provisioning with okta"" last updated exact: ""Mar 25, 2026, 2:39 PM"" last updated relative: ""Last updated 1 month ago"" breadcrumbs: ""Integrations"" ""Single Sign On (SSO)"" Setting Up SCIM Provi...","Extractive fallback from local corpus (integrations_security). Note: OpenRouter error: Error code: 429 - {'error': {'message': 'Provider returned error', 'code': 429, 'metadata': {'raw': 'google/gemma-4-26b-a4b-it:free is temporarily rate-limited upstream. Please retry shortly, or add your own key to accumulate your rate limits: https://openrouter.ai/settings/integrations', 'provider_name': 'Google AI Studio', 'is_byok': False}}, 'user_id': 'user_3DBHm4ADjGfuzNJ3wqQ4bnIGJul'}.",product_issue
,,,replied,api_usage,"Based on the support documentation: November 2025 November 24, 2025 Claude Opus 4.5 launch We released our most powerful frontier model to date. Read our blog post for more information: Introducing Claude Opus 4.5 . Claude for Excel beta release Claude for Excel is now available in beta to all Max, Team, and Enterprise users. We’ve added some additional capabilities, such as support for pivot tables, charts and file uploads, plus a shortcut to quickly open the full Claude app from Excel (ctrl+option+c).","Extractive fallback from local corpus (api_usage). Note: OpenRouter error: Error code: 429 - {'error': {'message': 'Rate limit exceeded: free-models-per-min. ', 'code': 429, 'metadata': {'headers': {'X-RateLimit-Limit': '20', 'X-RateLimit-Remaining': '0', 'X-RateLimit-Reset': '1777751640000'}, 'provider_name': None}}, 'user_id': 'user_3DBHm4ADjGfuzNJ3wqQ4bnIGJul'}.",bug
